{
  "schemaVersion": "1.0.0",
  "bundleId": "homegenome-export-bundle-001",
  "caseId": "case-export-001",
  "generatedAt": "2026-04-22T08:11:00.000Z",
  "generatedBy": "operator-export-001",
  "auditCheckpoint": {
    "aggregateId": "case-export-001",
    "generatedAt": "2026-04-22T08:11:00.000Z",
    "eventCount": 14,
    "latestVersion": 14,
    "firstEventHash": "sha256:54e2ae9e0c74b400a70b562e4bbc8dfd6238198f095203bf1844c68485e1d3b6",
    "lastEventHash": "sha256:d34f3a1d023d2feff6f9f8b04ee2ec81579a3ce5291126609460360094879a97",
    "checkpointHash": "sha256:06ef63a50d5d9f49345812f05ef6984904a50a5e61b696962c9ed66755aaf2ef"
  },
  "referenceBundles": [
    {
      "bundleId": "bundle-export-001",
      "name": "GRCh38 bundle",
      "version": "2026.04",
      "createdAt": "2026-04-22T08:03:00.000Z",
      "assets": [
        {
          "assetId": "grch38-fasta",
          "role": "REFERENCE_FASTA",
          "uri": "references/grch38.fa.gz",
          "checksum": "sha256:dddddddddddddddddddddddddddddddddddddddddddddddddddddddddddddddd"
        },
        {
          "assetId": "grch38-fai",
          "role": "REFERENCE_INDEX",
          "uri": "references/grch38.fa.gz.fai",
          "checksum": "sha256:eeeeeeeeeeeeeeeeeeeeeeeeeeeeeeeeeeeeeeeeeeeeeeeeeeeeeeeeeeeeeeee"
        }
      ]
    }
  ],
  "phenopacket": {
    "id": "case-export-001",
    "subject": {
      "id": "subject-export-001"
    },
    "biosamples": [
      {
        "id": "sample-export-001",
        "individualId": "subject-export-001",
        "sampleType": "saliva"
      }
    ],
    "files": [
      {
        "uri": "drs://homegenome.local/sha256-cccccccccccccccccccccccccccccccccccccccccccccccccccccccccccccccc",
        "description": "RAW_SIGNAL artifact artifact-export-001",
        "individualToFileIdentifiers": [
          "subject-export-001"
        ],
        "fileAttributes": {
          "fileFormat": "application/vnd.ont.pod5",
          "drsObjectId": "sha256-cccccccccccccccccccccccccccccccccccccccccccccccccccccccccccccccc",
          "checksum": "sha256:cccccccccccccccccccccccccccccccccccccccccccccccccccccccccccccccc"
        }
      }
    ],
    "interpretations": [
      {
        "id": "interpretation-analysis-run-export-001",
        "progressStatus": "RUNNING",
        "diagnosis": {
          "description": "wf-human-variation (bundle-export-001)"
        }
      }
    ],
    "metaData": {
      "created": "2026-04-22T08:11:00.000Z",
      "createdBy": "operator-export-001",
      "phenopacketSchemaVersion": "2.0",
      "resources": [
        {
          "id": "homegenome",
          "name": "HomeGenome local export vocabulary",
          "url": "https://github.com/KonkovaElena/HomeGenome",
          "version": "0.1.0",
          "namespacePrefix": "homegenome",
          "iriPrefix": "urn:homegenome:"
        }
      ]
    }
  },
  "roCrateMetadata": {
    "@context": "https://w3id.org/ro/crate/1.1/context",
    "@graph": [
      {
        "@id": "ro-crate-metadata.jsonld",
        "@type": "CreativeWork",
        "conformsTo": {
          "@id": "https://w3id.org/ro/crate/1.1"
        },
        "about": {
          "@id": "./"
        }
      },
      {
        "@id": "./",
        "@type": "Dataset",
        "name": "HomeGenome Case Bundle case-export-001",
        "identifier": "homegenome-export-bundle-001",
        "dateCreated": "2026-04-22T08:11:00.000Z",
        "license": {
          "@id": "https://spdx.org/licenses/MIT.html"
        },
        "creator": {
          "@id": "urn:homegenome:agent:operator-export-001"
        },
        "hasPart": [
          {
            "@id": "runs/run-export-001/raw.pod5"
          }
        ]
      },
      {
        "@id": "urn:homegenome:case:case-export-001",
        "@type": "Dataset",
        "name": "HomeGenome Case case-export-001",
        "identifier": "case-export-001",
        "dateCreated": "2026-04-22T08:00:00.000Z",
        "dateModified": "2026-04-22T08:10:00.000Z"
      },
      {
        "@id": "urn:homegenome:agent:operator-export-001",
        "@type": "Person",
        "name": "operator-export-001"
      },
      {
        "@id": "runs/run-export-001/raw.pod5",
        "@type": "File",
        "name": "artifact-export-001",
        "identifier": "drs://homegenome.local/sha256-cccccccccccccccccccccccccccccccccccccccccccccccccccccccccccccccc",
        "encodingFormat": "application/vnd.ont.pod5",
        "contentSize": 28,
        "dateCreated": "2026-04-22T08:06:00.000Z",
        "checksum": "cccccccccccccccccccccccccccccccccccccccccccccccccccccccccccccccc"
      }
    ]
  },
  "workflowRunCrates": [
    {
      "crateId": "run-analysis-run-export-001-crate",
      "runId": "analysis-run-export-001",
      "status": "RUNNING",
      "workflowName": "wf-human-variation",
      "executionProfile": "local-ont",
      "acceptedAt": "2026-04-22T08:10:00.000Z",
      "backend": "IN_MEMORY"
    }
  ],
  "drsObjects": [
    {
      "id": "sha256-cccccccccccccccccccccccccccccccccccccccccccccccccccccccccccccccc",
      "selfUri": "drs://homegenome.local/sha256-cccccccccccccccccccccccccccccccccccccccccccccccccccccccccccccccc",
      "sourceUri": "runs/run-export-001/raw.pod5",
      "name": "artifact-export-001",
      "createdTime": "2026-04-22T08:06:00.000Z",
      "mimeType": "application/vnd.ont.pod5",
      "checksums": [
        {
          "checksum": "cccccccccccccccccccccccccccccccccccccccccccccccccccccccccccccccc",
          "type": "sha-256"
        }
      ],
      "accessMethods": [
        {
          "type": "file",
          "accessUrl": {
            "url": "file:///runs/run-export-001/raw.pod5"
          }
        }
      ]
    }
  ],
  "prov": {
    "@context": "https://www.w3.org/ns/prov#",
    "entity": {
      "urn:homegenome:case:case-export-001": {
        "prov:type": "prov:Entity",
        "prov:label": "HomeGenome Case case-export-001"
      },
      "urn:homegenome:bundle:homegenome-export-bundle-001": {
        "prov:type": "prov:Entity",
        "prov:label": "HomeGenome Export Bundle homegenome-export-bundle-001"
      },
      "urn:homegenome:reference-bundle:bundle-export-001": {
        "prov:type": "prov:Entity",
        "prov:label": "Reference Bundle bundle-export-001",
        "prov:value": "2026.04"
      },
      "urn:homegenome:artifact:artifact-export-001": {
        "prov:type": "prov:Entity",
        "prov:label": "artifact-export-001"
      }
    },
    "activity": {
      "urn:homegenome:activity:bundle-export:case-export-001:2026-04-22T08:11:00.000Z": {
        "prov:type": "prov:Activity",
        "prov:startedAtTime": "2026-04-22T08:11:00.000Z",
        "prov:endedAtTime": "2026-04-22T08:11:00.000Z"
      }
    },
    "agent": {
      "urn:homegenome:agent:operator-export-001": {
        "prov:type": "prov:Person",
        "prov:label": "operator-export-001"
      }
    },
    "wasGeneratedBy": {
      "_:generated-1": {
        "prov:entity": "urn:homegenome:bundle:homegenome-export-bundle-001",
        "prov:activity": "urn:homegenome:activity:bundle-export:case-export-001:2026-04-22T08:11:00.000Z",
        "prov:time": "2026-04-22T08:11:00.000Z"
      }
    },
    "used": {
      "_:used-1": {
        "prov:activity": "urn:homegenome:activity:bundle-export:case-export-001:2026-04-22T08:11:00.000Z",
        "prov:entity": "urn:homegenome:case:case-export-001"
      },
      "_:used-2": {
        "prov:activity": "urn:homegenome:activity:bundle-export:case-export-001:2026-04-22T08:11:00.000Z",
        "prov:entity": "urn:homegenome:reference-bundle:bundle-export-001"
      },
      "_:used-3": {
        "prov:activity": "urn:homegenome:activity:bundle-export:case-export-001:2026-04-22T08:11:00.000Z",
        "prov:entity": "urn:homegenome:artifact:artifact-export-001"
      }
    },
    "wasAssociatedWith": {
      "_:associated-1": {
        "prov:activity": "urn:homegenome:activity:bundle-export:case-export-001:2026-04-22T08:11:00.000Z",
        "prov:agent": "urn:homegenome:agent:operator-export-001"
      }
    },
    "wasDerivedFrom": {
      "_:derived-1": {
        "prov:generatedEntity": "urn:homegenome:bundle:homegenome-export-bundle-001",
        "prov:usedEntity": "urn:homegenome:case:case-export-001"
      },
      "_:derived-2": {
        "prov:generatedEntity": "urn:homegenome:bundle:homegenome-export-bundle-001",
        "prov:usedEntity": "urn:homegenome:reference-bundle:bundle-export-001"
      },
      "_:derived-3": {
        "prov:generatedEntity": "urn:homegenome:bundle:homegenome-export-bundle-001",
        "prov:usedEntity": "urn:homegenome:artifact:artifact-export-001"
      }
    }
  },
  "snapshot": {
    "caseRecord": {
      "caseId": "case-export-001",
      "subjectId": "subject-export-001",
      "status": "PRIMARY_ANALYSIS_RUNNING",
      "createdAt": "2026-04-22T08:00:00.000Z",
      "updatedAt": "2026-04-22T08:10:00.000Z"
    },
    "samples": [
      {
        "sampleId": "sample-export-001",
        "caseId": "case-export-001",
        "sampleType": "saliva",
        "collectedAt": "2026-04-22T08:01:00.000Z",
        "createdAt": "2026-04-22T08:02:00.000Z"
      }
    ],
    "runs": [
      {
        "runId": "run-export-001",
        "caseId": "case-export-001",
        "sampleId": "sample-export-001",
        "platform": "ONT_MINION",
        "referenceBundleId": "bundle-export-001",
        "status": "RUNNING",
        "createdAt": "2026-04-22T08:04:00.000Z",
        "updatedAt": "2026-04-22T08:05:00.000Z"
      }
    ],
    "workflowDispatches": [
      {
        "dispatchId": "dispatch-export-001",
        "caseId": "case-export-001",
        "requestId": "request-export-001",
        "workflowName": "wf-human-variation",
        "referenceBundleId": "bundle-export-001",
        "executionProfile": "local-ont",
        "requestedAt": "2026-04-22T08:09:00.000Z",
        "status": "PENDING"
      }
    ],
    "workflowRuns": [
      {